{
  "schemaVersion": "1.0.0",
  "animationId": "production-lite-articulation-stress",
  "rig": {
    "rigId": "production-lite-character-layout",
    "schemaVersion": "1.0.0"
  },
  "duration": 2.4,
  "loop": true,
  "tracks": [
    {
      "jointId": "head",
      "property": "rotation",
      "keyframes": [
        {
          "time": 0,
          "value": 0,
          "interpolation": "linear",
          "easing": "ease-in-out-sine"
        },
        {
          "time": 0.6,
          "value": -8,
          "interpolation": "linear",
          "easing": "ease-in-out-sine"
        },
        {
          "time": 1.2,
          "value": 8,
          "interpolation": "linear",
          "easing": "ease-in-out-sine"
        },
        {
          "time": 1.8,
          "value": -8,
          "interpolation": "linear",
          "easing": "ease-in-out-sine"
        },
        {
          "time": 2.4,
          "value": 0,
          "interpolation": "linear",
          "easing": "ease-in-out-sine"
        }
      ]
    },
    {
      "jointId": "upper-arm-left",
      "property": "rotation",
      "keyframes": [
        {
          "time": 0,
          "value": 0,
          "interpolation": "linear",
          "easing": "ease-in-out-sine"
        },
        {
          "time": 0.6,
          "value": 62,
          "interpolation": "linear",
          "easing": "ease-in-out-sine"
        },
        {
          "time": 1.2,
          "value": -34,
          "interpolation": "linear",
          "easing": "ease-in-out-sine"
        },
        {
          "time": 1.8,
          "value": 44,
          "interpolation": "linear",
          "easing": "ease-in-out-sine"
        },
        {
          "time": 2.4,
          "value": 0,
          "interpolation": "linear",
          "easing": "ease-in-out-sine"
        }
      ]
    },
    {
      "jointId": "lower-arm-left",
      "property": "rotation",
      "keyframes": [
        {
          "time": 0,
          "value": 0,
          "interpolation": "linear",
          "easing": "ease-in-out-sine"
        },
        {
          "time": 0.6,
          "value": -68,
          "interpolation": "linear",
          "easing": "ease-in-out-sine"
        },
        {
          "time": 1.2,
          "value": 38,
          "interpolation": "linear",
          "easing": "ease-in-out-sine"
        },
        {
          "time": 1.8,
          "value": -44,
          "interpolation": "linear",
          "easing": "ease-in-out-sine"
        },
        {
          "time": 2.4,
          "value": 0,
          "interpolation": "linear",
          "easing": "ease-in-out-sine"
        }
      ]
    },
    {
      "jointId": "upper-arm-right",
      "property": "rotation",
      "keyframes": [
        {
          "time": 0,
          "value": 0,
          "interpolation": "linear",
          "easing": "ease-in-out-sine"
        },
        {
          "time": 0.6,
          "value": -42,
          "interpolation": "linear",
          "easing": "ease-in-out-sine"
        },
        {
          "time": 1.2,
          "value": 58,
          "interpolation": "linear",
          "easing": "ease-in-out-sine"
        },
        {
          "time": 1.8,
          "value": -58,
          "interpolation": "linear",
          "easing": "ease-in-out-sine"
        },
        {
          "time": 2.4,
          "value": 0,
          "interpolation": "linear",
          "easing": "ease-in-out-sine"
        }
      ]
    },
    {
      "jointId": "lower-arm-right",
      "property": "rotation",
      "keyframes": [
        {
          "time": 0,
          "value": 0,
          "interpolation": "linear",
          "easing": "ease-in-out-sine"
        },
        {
          "time": 0.6,
          "value": 52,
          "interpolation": "linear",
          "easing": "ease-in-out-sine"
        },
        {
          "time": 1.2,
          "value": -64,
          "interpolation": "linear",
          "easing": "ease-in-out-sine"
        },
        {
          "time": 1.8,
          "value": 48,
          "interpolation": "linear",
          "easing": "ease-in-out-sine"
        },
        {
          "time": 2.4,
          "value": 0,
          "interpolation": "linear",
          "easing": "ease-in-out-sine"
        }
      ]
    },
    {
      "jointId": "thigh-left",
      "property": "rotation",
      "keyframes": [
        {
          "time": 0,
          "value": 0,
          "interpolation": "linear",
          "easing": "ease-in-out-sine"
        },
        {
          "time": 0.6,
          "value": 30,
          "interpolation": "linear",
          "easing": "ease-in-out-sine"
        },
        {
          "time": 1.2,
          "value": -30,
          "interpolation": "linear",
          "easing": "ease-in-out-sine"
        },
        {
          "time": 1.8,
          "value": 22,
          "interpolation": "linear",
          "easing": "ease-in-out-sine"
        },
        {
          "time": 2.4,
          "value": 0,
          "interpolation": "linear",
          "easing": "ease-in-out-sine"
        }
      ]
    },
    {
      "jointId": "shin-left",
      "property": "rotation",
      "keyframes": [
        {
          "time": 0,
          "value": 0,
          "interpolation": "linear",
          "easing": "ease-in-out-sine"
        },
        {
          "time": 0.6,
          "value": 34,
          "interpolation": "linear",
          "easing": "ease-in-out-sine"
        },
        {
          "time": 1.2,
          "value": 12,
          "interpolation": "linear",
          "easing": "ease-in-out-sine"
        },
        {
          "time": 1.8,
          "value": 46,
          "interpolation": "linear",
          "easing": "ease-in-out-sine"
        },
        {
          "time": 2.4,
          "value": 0,
          "interpolation": "linear",
          "easing": "ease-in-out-sine"
        }
      ]
    },
    {
      "jointId": "shoe-left",
      "property": "rotation",
      "keyframes": [
        {
          "time": 0,
          "value": 0,
          "interpolation": "linear",
          "easing": "ease-in-out-sine"
        },
        {
          "time": 0.6,
          "value": -12,
          "interpolation": "linear",
          "easing": "ease-in-out-sine"
        },
        {
          "time": 1.2,
          "value": 10,
          "interpolation": "linear",
          "easing": "ease-in-out-sine"
        },
        {
          "time": 1.8,
          "value": -8,
          "interpolation": "linear",
          "easing": "ease-in-out-sine"
        },
        {
          "time": 2.4,
          "value": 0,
          "interpolation": "linear",
          "easing": "ease-in-out-sine"
        }
      ]
    },
    {
      "jointId": "thigh-right",
      "property": "rotation",
      "keyframes": [
        {
          "time": 0,
          "value": 0,
          "interpolation": "linear",
          "easing": "ease-in-out-sine"
        },
        {
          "time": 0.6,
          "value": -30,
          "interpolation": "linear",
          "easing": "ease-in-out-sine"
        },
        {
          "time": 1.2,
          "value": 30,
          "interpolation": "linear",
          "easing": "ease-in-out-sine"
        },
        {
          "time": 1.8,
          "value": -22,
          "interpolation": "linear",
          "easing": "ease-in-out-sine"
        },
        {
          "time": 2.4,
          "value": 0,
          "interpolation": "linear",
          "easing": "ease-in-out-sine"
        }
      ]
    },
    {
      "jointId": "shin-right",
      "property": "rotation",
      "keyframes": [
        {
          "time": 0,
          "value": 0,
          "interpolation": "linear",
          "easing": "ease-in-out-sine"
        },
        {
          "time": 0.6,
          "value": 12,
          "interpolation": "linear",
          "easing": "ease-in-out-sine"
        },
        {
          "time": 1.2,
          "value": 34,
          "interpolation": "linear",
          "easing": "ease-in-out-sine"
        },
        {
          "time": 1.8,
          "value": 46,
          "interpolation": "linear",
          "easing": "ease-in-out-sine"
        },
        {
          "time": 2.4,
          "value": 0,
          "interpolation": "linear",
          "easing": "ease-in-out-sine"
        }
      ]
    },
    {
      "jointId": "shoe-right",
      "property": "rotation",
      "keyframes": [
        {
          "time": 0,
          "value": 0,
          "interpolation": "linear",
          "easing": "ease-in-out-sine"
        },
        {
          "time": 0.6,
          "value": 10,
          "interpolation": "linear",
          "easing": "ease-in-out-sine"
        },
        {
          "time": 1.2,
          "value": -12,
          "interpolation": "linear",
          "easing": "ease-in-out-sine"
        },
        {
          "time": 1.8,
          "value": 8,
          "interpolation": "linear",
          "easing": "ease-in-out-sine"
        },
        {
          "time": 2.4,
          "value": 0,
          "interpolation": "linear",
          "easing": "ease-in-out-sine"
        }
      ]
    }
  ]
}
