{
  "schemaVersion": "1.0.0",
  "animationId": "production-lite-prop-stress",
  "rig": {
    "rigId": "production-lite-character-layout",
    "schemaVersion": "1.0.0"
  },
  "duration": 3.2,
  "loop": true,
  "tracks": [
    {
      "jointId": "torso",
      "property": "rotation",
      "keyframes": [
        {
          "time": 0,
          "value": 0,
          "interpolation": "linear",
          "easing": "ease-in-out-sine"
        },
        {
          "time": 0.8,
          "value": -8,
          "interpolation": "linear",
          "easing": "ease-in-out-sine"
        },
        {
          "time": 1.6,
          "value": 10,
          "interpolation": "linear",
          "easing": "ease-in-out-sine"
        },
        {
          "time": 2.4,
          "value": -6,
          "interpolation": "linear",
          "easing": "ease-in-out-sine"
        },
        {
          "time": 3.2,
          "value": 0,
          "interpolation": "linear",
          "easing": "ease-in-out-sine"
        }
      ]
    },
    {
      "jointId": "upper-arm-left",
      "property": "rotation",
      "keyframes": [
        {
          "time": 0,
          "value": 0,
          "interpolation": "linear",
          "easing": "ease-in-out-sine"
        },
        {
          "time": 0.8,
          "value": 78,
          "interpolation": "linear",
          "easing": "ease-in-out-sine"
        },
        {
          "time": 1.6,
          "value": -54,
          "interpolation": "linear",
          "easing": "ease-in-out-sine"
        },
        {
          "time": 2.4,
          "value": 62,
          "interpolation": "linear",
          "easing": "ease-in-out-sine"
        },
        {
          "time": 3.2,
          "value": 0,
          "interpolation": "linear",
          "easing": "ease-in-out-sine"
        }
      ]
    },
    {
      "jointId": "lower-arm-left",
      "property": "rotation",
      "keyframes": [
        {
          "time": 0,
          "value": 0,
          "interpolation": "linear",
          "easing": "ease-in-out-sine"
        },
        {
          "time": 0.8,
          "value": -104,
          "interpolation": "linear",
          "easing": "ease-in-out-sine"
        },
        {
          "time": 1.6,
          "value": 72,
          "interpolation": "linear",
          "easing": "ease-in-out-sine"
        },
        {
          "time": 2.4,
          "value": -88,
          "interpolation": "linear",
          "easing": "ease-in-out-sine"
        },
        {
          "time": 3.2,
          "value": 0,
          "interpolation": "linear",
          "easing": "ease-in-out-sine"
        }
      ]
    },
    {
      "jointId": "hand-left",
      "property": "rotation",
      "keyframes": [
        {
          "time": 0,
          "value": 0,
          "interpolation": "linear",
          "easing": "ease-in-out-sine"
        },
        {
          "time": 0.8,
          "value": 58,
          "interpolation": "linear",
          "easing": "ease-in-out-sine"
        },
        {
          "time": 1.6,
          "value": -66,
          "interpolation": "linear",
          "easing": "ease-in-out-sine"
        },
        {
          "time": 2.4,
          "value": 72,
          "interpolation": "linear",
          "easing": "ease-in-out-sine"
        },
        {
          "time": 3.2,
          "value": 0,
          "interpolation": "linear",
          "easing": "ease-in-out-sine"
        }
      ]
    },
    {
      "jointId": "thigh-left",
      "property": "rotation",
      "keyframes": [
        {
          "time": 0,
          "value": 0,
          "interpolation": "linear",
          "easing": "ease-in-out-sine"
        },
        {
          "time": 0.8,
          "value": 20,
          "interpolation": "linear",
          "easing": "ease-in-out-sine"
        },
        {
          "time": 1.6,
          "value": -26,
          "interpolation": "linear",
          "easing": "ease-in-out-sine"
        },
        {
          "time": 2.4,
          "value": 16,
          "interpolation": "linear",
          "easing": "ease-in-out-sine"
        },
        {
          "time": 3.2,
          "value": 0,
          "interpolation": "linear",
          "easing": "ease-in-out-sine"
        }
      ]
    }
  ]
}
