{
  "schemaVersion": "1.0.0",
  "animationId": "stickman-rest-idle",
  "rig": {
    "rigId": "stickman-reference-layout",
    "schemaVersion": "1.0.0"
  },
  "duration": 2,
  "loop": true,
  "tracks": [
    {
      "jointId": "torso",
      "property": "position",
      "keyframes": [
        { "time": 0, "value": { "x": 0, "y": 0 }, "interpolation": "linear", "easing": "ease-in-out-sine" },
        { "time": 1, "value": { "x": 0, "y": 2 }, "interpolation": "linear", "easing": "ease-in-out-sine" },
        { "time": 2, "value": { "x": 0, "y": 0 }, "interpolation": "linear", "easing": "linear" }
      ]
    },
    {
      "jointId": "head",
      "property": "rotation",
      "keyframes": [
        { "time": 0, "value": 0, "interpolation": "linear", "easing": "ease-in-out-sine" },
        { "time": 1, "value": 2, "interpolation": "linear", "easing": "ease-in-out-sine" },
        { "time": 2, "value": 0, "interpolation": "linear", "easing": "linear" }
      ]
    }
  ]
}
