{
  "schemaVersion": "1.0.0",
  "animationId": "simple-sprite-walk-cycle",
  "rig": {
    "rigId": "simple-sprite-character-layout",
    "schemaVersion": "1.0.0"
  },
  "duration": 1.2,
  "loop": true,
  "tracks": [
    {
      "jointId": "pelvis",
      "property": "position",
      "keyframes": [
        {
          "time": 0,
          "value": {
            "x": 0,
            "y": 0
          },
          "interpolation": "linear",
          "easing": "ease-in-out-sine"
        },
        {
          "time": 0.3,
          "value": {
            "x": 0,
            "y": 4
          },
          "interpolation": "linear",
          "easing": "ease-in-out-sine"
        },
        {
          "time": 0.6,
          "value": {
            "x": 0,
            "y": 0
          },
          "interpolation": "linear",
          "easing": "ease-in-out-sine"
        },
        {
          "time": 0.9,
          "value": {
            "x": 0,
            "y": 4
          },
          "interpolation": "linear",
          "easing": "ease-in-out-sine"
        },
        {
          "time": 1.2,
          "value": {
            "x": 0,
            "y": 0
          },
          "interpolation": "linear",
          "easing": "linear"
        }
      ]
    },
    {
      "jointId": "upper-arm-left",
      "property": "rotation",
      "keyframes": [
        {
          "time": 0,
          "value": -25,
          "interpolation": "linear",
          "easing": "ease-in-out-sine"
        },
        {
          "time": 0.6,
          "value": 25,
          "interpolation": "linear",
          "easing": "ease-in-out-sine"
        },
        {
          "time": 1.2,
          "value": -25,
          "interpolation": "linear",
          "easing": "linear"
        }
      ]
    },
    {
      "jointId": "upper-arm-right",
      "property": "rotation",
      "keyframes": [
        {
          "time": 0,
          "value": 25,
          "interpolation": "linear",
          "easing": "ease-in-out-sine"
        },
        {
          "time": 0.6,
          "value": -25,
          "interpolation": "linear",
          "easing": "ease-in-out-sine"
        },
        {
          "time": 1.2,
          "value": 25,
          "interpolation": "linear",
          "easing": "linear"
        }
      ]
    },
    {
      "jointId": "lower-arm-left",
      "property": "rotation",
      "keyframes": [
        {
          "time": 0,
          "value": -12,
          "interpolation": "linear",
          "easing": "ease-in-out-sine"
        },
        {
          "time": 0.6,
          "value": -32,
          "interpolation": "linear",
          "easing": "ease-in-out-sine"
        },
        {
          "time": 1.2,
          "value": -12,
          "interpolation": "linear",
          "easing": "linear"
        }
      ]
    },
    {
      "jointId": "lower-arm-right",
      "property": "rotation",
      "keyframes": [
        {
          "time": 0,
          "value": 32,
          "interpolation": "linear",
          "easing": "ease-in-out-sine"
        },
        {
          "time": 0.6,
          "value": 12,
          "interpolation": "linear",
          "easing": "ease-in-out-sine"
        },
        {
          "time": 1.2,
          "value": 32,
          "interpolation": "linear",
          "easing": "linear"
        }
      ]
    },
    {
      "jointId": "thigh-left",
      "property": "rotation",
      "keyframes": [
        {
          "time": 0,
          "value": 30,
          "interpolation": "linear",
          "easing": "ease-in-out-sine"
        },
        {
          "time": 0.6,
          "value": -30,
          "interpolation": "linear",
          "easing": "ease-in-out-sine"
        },
        {
          "time": 1.2,
          "value": 30,
          "interpolation": "linear",
          "easing": "linear"
        }
      ]
    },
    {
      "jointId": "thigh-right",
      "property": "rotation",
      "keyframes": [
        {
          "time": 0,
          "value": -30,
          "interpolation": "linear",
          "easing": "ease-in-out-sine"
        },
        {
          "time": 0.6,
          "value": 30,
          "interpolation": "linear",
          "easing": "ease-in-out-sine"
        },
        {
          "time": 1.2,
          "value": -30,
          "interpolation": "linear",
          "easing": "linear"
        }
      ]
    },
    {
      "jointId": "shin-left",
      "property": "rotation",
      "keyframes": [
        {
          "time": 0,
          "value": 8,
          "interpolation": "linear",
          "easing": "ease-in-out-sine"
        },
        {
          "time": 0.3,
          "value": 38,
          "interpolation": "linear",
          "easing": "ease-in-out-sine"
        },
        {
          "time": 0.6,
          "value": 10,
          "interpolation": "linear",
          "easing": "ease-in-out-sine"
        },
        {
          "time": 1.2,
          "value": 8,
          "interpolation": "linear",
          "easing": "linear"
        }
      ]
    },
    {
      "jointId": "shin-right",
      "property": "rotation",
      "keyframes": [
        {
          "time": 0,
          "value": -10,
          "interpolation": "linear",
          "easing": "ease-in-out-sine"
        },
        {
          "time": 0.6,
          "value": -8,
          "interpolation": "linear",
          "easing": "ease-in-out-sine"
        },
        {
          "time": 0.9,
          "value": -38,
          "interpolation": "linear",
          "easing": "ease-in-out-sine"
        },
        {
          "time": 1.2,
          "value": -10,
          "interpolation": "linear",
          "easing": "linear"
        }
      ]
    },
    {
      "jointId": "foot-left",
      "property": "rotation",
      "keyframes": [
        {
          "time": 0,
          "value": -8,
          "interpolation": "linear",
          "easing": "ease-in-out-sine"
        },
        {
          "time": 0.6,
          "value": 12,
          "interpolation": "linear",
          "easing": "ease-in-out-sine"
        },
        {
          "time": 1.2,
          "value": -8,
          "interpolation": "linear",
          "easing": "linear"
        }
      ]
    },
    {
      "jointId": "foot-right",
      "property": "rotation",
      "keyframes": [
        {
          "time": 0,
          "value": -12,
          "interpolation": "linear",
          "easing": "ease-in-out-sine"
        },
        {
          "time": 0.6,
          "value": 8,
          "interpolation": "linear",
          "easing": "ease-in-out-sine"
        },
        {
          "time": 1.2,
          "value": -12,
          "interpolation": "linear",
          "easing": "linear"
        }
      ]
    }
  ]
}
