{
  "schemaVersion": "1.0.0",
  "animationId": "red-cap-production-v1-walk",
  "rig": {
    "rigId": "red-cap-production-v1-layout",
    "schemaVersion": "1.0.0"
  },
  "duration": 1.2,
  "loop": true,
  "tracks": [
    {
      "jointId": "upper-arm-left",
      "property": "rotation",
      "keyframes": [
        {
          "time": 0,
          "value": -18,
          "interpolation": "linear",
          "easing": "ease-in-out-sine"
        },
        {
          "time": 0.6,
          "value": 18,
          "interpolation": "linear",
          "easing": "ease-in-out-sine"
        },
        {
          "time": 1.2,
          "value": -18,
          "interpolation": "linear",
          "easing": "ease-in-out-sine"
        }
      ]
    },
    {
      "jointId": "upper-arm-right",
      "property": "rotation",
      "keyframes": [
        {
          "time": 0,
          "value": 18,
          "interpolation": "linear",
          "easing": "ease-in-out-sine"
        },
        {
          "time": 0.6,
          "value": -18,
          "interpolation": "linear",
          "easing": "ease-in-out-sine"
        },
        {
          "time": 1.2,
          "value": 18,
          "interpolation": "linear",
          "easing": "ease-in-out-sine"
        }
      ]
    },
    {
      "jointId": "forearm-left",
      "property": "rotation",
      "keyframes": [
        {
          "time": 0,
          "value": -8,
          "interpolation": "linear",
          "easing": "ease-in-out-sine"
        },
        {
          "time": 0.6,
          "value": -20,
          "interpolation": "linear",
          "easing": "ease-in-out-sine"
        },
        {
          "time": 1.2,
          "value": -8,
          "interpolation": "linear",
          "easing": "ease-in-out-sine"
        }
      ]
    },
    {
      "jointId": "forearm-right",
      "property": "rotation",
      "keyframes": [
        {
          "time": 0,
          "value": -20,
          "interpolation": "linear",
          "easing": "ease-in-out-sine"
        },
        {
          "time": 0.6,
          "value": -8,
          "interpolation": "linear",
          "easing": "ease-in-out-sine"
        },
        {
          "time": 1.2,
          "value": -20,
          "interpolation": "linear",
          "easing": "ease-in-out-sine"
        }
      ]
    },
    {
      "jointId": "thigh-right",
      "property": "rotation",
      "keyframes": [
        {
          "time": 0,
          "value": 0,
          "interpolation": "linear",
          "easing": "ease-in-out-sine"
        },
        {
          "time": 0.15,
          "value": -14,
          "interpolation": "linear",
          "easing": "ease-in-out-sine"
        },
        {
          "time": 0.3,
          "value": -24,
          "interpolation": "linear",
          "easing": "ease-in-out-sine"
        },
        {
          "time": 0.45,
          "value": -12,
          "interpolation": "linear",
          "easing": "ease-in-out-sine"
        },
        {
          "time": 0.6,
          "value": 0,
          "interpolation": "linear",
          "easing": "ease-in-out-sine"
        },
        {
          "time": 1.2,
          "value": 0,
          "interpolation": "linear",
          "easing": "ease-in-out-sine"
        }
      ]
    },
    {
      "jointId": "shin-right",
      "property": "rotation",
      "keyframes": [
        {
          "time": 0,
          "value": 0,
          "interpolation": "linear",
          "easing": "ease-in-out-sine"
        },
        {
          "time": 0.2,
          "value": 24,
          "interpolation": "linear",
          "easing": "ease-in-out-sine"
        },
        {
          "time": 0.4,
          "value": 12,
          "interpolation": "linear",
          "easing": "ease-in-out-sine"
        },
        {
          "time": 0.6,
          "value": 0,
          "interpolation": "linear",
          "easing": "ease-in-out-sine"
        },
        {
          "time": 1.2,
          "value": 0,
          "interpolation": "linear",
          "easing": "ease-in-out-sine"
        }
      ]
    },
    {
      "jointId": "foot-right",
      "property": "rotation",
      "keyframes": [
        {
          "time": 0,
          "value": 0,
          "interpolation": "linear",
          "easing": "ease-in-out-sine"
        },
        {
          "time": 0.2,
          "value": -8,
          "interpolation": "linear",
          "easing": "ease-in-out-sine"
        },
        {
          "time": 0.4,
          "value": 5,
          "interpolation": "linear",
          "easing": "ease-in-out-sine"
        },
        {
          "time": 0.6,
          "value": 0,
          "interpolation": "linear",
          "easing": "ease-in-out-sine"
        },
        {
          "time": 1.2,
          "value": 0,
          "interpolation": "linear",
          "easing": "ease-in-out-sine"
        }
      ]
    },
    {
      "jointId": "thigh-left",
      "property": "rotation",
      "keyframes": [
        {
          "time": 0,
          "value": 0,
          "interpolation": "linear",
          "easing": "ease-in-out-sine"
        },
        {
          "time": 0.6,
          "value": 0,
          "interpolation": "linear",
          "easing": "ease-in-out-sine"
        },
        {
          "time": 0.75,
          "value": 14,
          "interpolation": "linear",
          "easing": "ease-in-out-sine"
        },
        {
          "time": 0.9,
          "value": 24,
          "interpolation": "linear",
          "easing": "ease-in-out-sine"
        },
        {
          "time": 1.05,
          "value": 12,
          "interpolation": "linear",
          "easing": "ease-in-out-sine"
        },
        {
          "time": 1.2,
          "value": 0,
          "interpolation": "linear",
          "easing": "ease-in-out-sine"
        }
      ]
    },
    {
      "jointId": "shin-left",
      "property": "rotation",
      "keyframes": [
        {
          "time": 0,
          "value": 0,
          "interpolation": "linear",
          "easing": "ease-in-out-sine"
        },
        {
          "time": 0.6,
          "value": 0,
          "interpolation": "linear",
          "easing": "ease-in-out-sine"
        },
        {
          "time": 0.8,
          "value": 24,
          "interpolation": "linear",
          "easing": "ease-in-out-sine"
        },
        {
          "time": 1,
          "value": 12,
          "interpolation": "linear",
          "easing": "ease-in-out-sine"
        },
        {
          "time": 1.2,
          "value": 0,
          "interpolation": "linear",
          "easing": "ease-in-out-sine"
        }
      ]
    },
    {
      "jointId": "foot-left",
      "property": "rotation",
      "keyframes": [
        {
          "time": 0,
          "value": 0,
          "interpolation": "linear",
          "easing": "ease-in-out-sine"
        },
        {
          "time": 0.6,
          "value": 0,
          "interpolation": "linear",
          "easing": "ease-in-out-sine"
        },
        {
          "time": 0.8,
          "value": 8,
          "interpolation": "linear",
          "easing": "ease-in-out-sine"
        },
        {
          "time": 1,
          "value": -5,
          "interpolation": "linear",
          "easing": "ease-in-out-sine"
        },
        {
          "time": 1.2,
          "value": 0,
          "interpolation": "linear",
          "easing": "ease-in-out-sine"
        }
      ]
    }
  ]
}
