{
  "schemaVersion": "1.0.0",
  "animationId": "red-cap-production-v1-wave",
  "rig": {
    "rigId": "red-cap-production-v1-layout",
    "schemaVersion": "1.0.0"
  },
  "duration": 1.2,
  "loop": true,
  "tracks": [
    {
      "jointId": "upper-arm-left",
      "property": "rotation",
      "keyframes": [
        {
          "time": 0,
          "value": 0,
          "interpolation": "linear",
          "easing": "ease-in-out-sine"
        },
        {
          "time": 0.3,
          "value": 112,
          "interpolation": "linear",
          "easing": "ease-in-out-sine"
        },
        {
          "time": 0.6,
          "value": 92,
          "interpolation": "linear",
          "easing": "ease-in-out-sine"
        },
        {
          "time": 0.9,
          "value": 112,
          "interpolation": "linear",
          "easing": "ease-in-out-sine"
        },
        {
          "time": 1.2,
          "value": 0,
          "interpolation": "linear",
          "easing": "ease-in-out-sine"
        }
      ]
    },
    {
      "jointId": "forearm-left",
      "property": "rotation",
      "keyframes": [
        {
          "time": 0,
          "value": 0,
          "interpolation": "linear",
          "easing": "ease-in-out-sine"
        },
        {
          "time": 0.3,
          "value": -68,
          "interpolation": "linear",
          "easing": "ease-in-out-sine"
        },
        {
          "time": 0.6,
          "value": -108,
          "interpolation": "linear",
          "easing": "ease-in-out-sine"
        },
        {
          "time": 0.9,
          "value": -68,
          "interpolation": "linear",
          "easing": "ease-in-out-sine"
        },
        {
          "time": 1.2,
          "value": 0,
          "interpolation": "linear",
          "easing": "ease-in-out-sine"
        }
      ]
    },
    {
      "jointId": "hand-left",
      "property": "rotation",
      "keyframes": [
        {
          "time": 0,
          "value": 0,
          "interpolation": "linear",
          "easing": "ease-in-out-sine"
        },
        {
          "time": 0.3,
          "value": 12,
          "interpolation": "linear",
          "easing": "ease-in-out-sine"
        },
        {
          "time": 0.6,
          "value": -12,
          "interpolation": "linear",
          "easing": "ease-in-out-sine"
        },
        {
          "time": 0.9,
          "value": 12,
          "interpolation": "linear",
          "easing": "ease-in-out-sine"
        },
        {
          "time": 1.2,
          "value": 0,
          "interpolation": "linear",
          "easing": "ease-in-out-sine"
        }
      ]
    }
  ]
}
