{
  "schemaVersion": "1.0.0",
  "animationId": "stickman-arm-wave",
  "rig": {
    "rigId": "stickman-reference-layout",
    "schemaVersion": "1.0.0"
  },
  "duration": 2,
  "loop": true,
  "tracks": [
    {
      "jointId": "upper-arm-right",
      "property": "rotation",
      "keyframes": [
        { "time": 0, "value": 0, "interpolation": "linear", "easing": "ease-in-out-sine" },
        { "time": 0.4, "value": 100, "interpolation": "linear", "easing": "ease-in-out-sine" },
        { "time": 1.6, "value": 100, "interpolation": "linear", "easing": "ease-in-out-sine" },
        { "time": 2, "value": 0, "interpolation": "linear", "easing": "linear" }
      ]
    },
    {
      "jointId": "lower-arm-right",
      "property": "rotation",
      "keyframes": [
        { "time": 0, "value": 0, "interpolation": "linear", "easing": "ease-in-out-sine" },
        { "time": 0.4, "value": -65, "interpolation": "linear", "easing": "ease-in-out-sine" },
        { "time": 0.7, "value": -25, "interpolation": "linear", "easing": "ease-in-out-sine" },
        { "time": 1, "value": -70, "interpolation": "linear", "easing": "ease-in-out-sine" },
        { "time": 1.3, "value": -25, "interpolation": "linear", "easing": "ease-in-out-sine" },
        { "time": 1.6, "value": -65, "interpolation": "linear", "easing": "ease-in-out-sine" },
        { "time": 2, "value": 0, "interpolation": "linear", "easing": "linear" }
      ]
    },
    {
      "jointId": "hand-right",
      "property": "rotation",
      "keyframes": [
        { "time": 0, "value": 0, "interpolation": "linear", "easing": "ease-in-out-sine" },
        { "time": 0.4, "value": 15, "interpolation": "linear", "easing": "ease-in-out-sine" },
        { "time": 0.7, "value": -15, "interpolation": "linear", "easing": "ease-in-out-sine" },
        { "time": 1, "value": 15, "interpolation": "linear", "easing": "ease-in-out-sine" },
        { "time": 1.3, "value": -15, "interpolation": "linear", "easing": "ease-in-out-sine" },
        { "time": 1.6, "value": 15, "interpolation": "linear", "easing": "ease-in-out-sine" },
        { "time": 2, "value": 0, "interpolation": "linear", "easing": "linear" }
      ]
    }
  ]
}
